{
  "$schema": "https://json-schema.org/draft/2020-12/schema",
  "$id": "https://retroarchivebox.invalid/schemas/malware-provider-request-v1.json",
  "title": "RAB to AVBox malware analysis request",
  "type": "object",
  "required": ["protocol_version", "request_id", "object", "requested_profile", "profile_version", "analysis_policy"],
  "properties": {
    "protocol_version": {"const": "1"},
    "request_id": {"type": "string", "pattern": "^avreq-[0-9a-f]{32}(-[0-9a-f]{8})?$"},
    "object": {"type": "object", "required": ["sha256", "size", "representation"], "properties": {"sha256": {"type": "string", "pattern": "^[0-9a-f]{64}$"}, "size": {"type": "integer", "minimum": 0}, "representation": {"type": "string"}, "format_hint": {"type": ["string", "null"]}, "platform_hint": {"type": ["string", "null"]}}, "additionalProperties": false},
    "requested_profile": {"type": "string"},
    "profile_version": {"type": "string"},
    "analysis_policy": {"type": "object"}
  },
  "additionalProperties": false
}
