{"protocol_version":"1","request_id":"avreq-11111111111111111111111111111111","object":{"sha256":"aaaaaaaaaaaaaaaaaaaaaaaaaaaaaaaaaaaaaaaaaaaaaaaaaaaaaaaaaaaaaaaa","size":1024,"representation":"adf","format_hint":"adf","platform_hint":"amiga"},"requested_profile":"amiga-historical","profile_version":"2026.1","analysis_policy":{"desired_coverage":"provider-profile","max_observations":256}}
